{
  "id": "weekly-2026-W26",
  "type": "weekly",
  "period": { "label": "2026년 6월 4주차 (6/22–6/28)", "start": "2026-06-22", "end": "2026-06-28" },
  "generatedAt": "2026-07-04T18:00:00+09:00",
  "sources": ["outlook", "outlook_calendar"],
  "summary": "마곡 사옥의 Edge 데이터센터 컨버전 전제 매각(세빌스 CA 협의)과 우정사업본부 인터넷 PC 제안(KT 협업, 7/3 마감)이 주간의 두 축이었습니다. 충남대병원이 VMware 성능 이슈로 틸론 VDI PoC를 요청하고 포스코가 Citrix 계약 종료 후 대체를 검토하는 등, 글로벌 VDI 대체 기회가 동시에 열렸습니다. 7/2 하반기 사업계획 발표와 7/8 다수 PoC가 임박해 다음 주 실행 밀도가 높습니다. (수·발신 총량은 Outlook 실측, 일자별·카테고리는 표본 기반 추정)",
  "email": {
    "totalReceived": 278,
    "totalSent": 22,
    "unreplied": 6,
    "avgResponseHours": 4.5,
    "byDay": [
      { "day": "월", "received": 58, "sent": 5 },
      { "day": "화", "received": 54, "sent": 4 },
      { "day": "수", "received": 52, "sent": 4 },
      { "day": "목", "received": 46, "sent": 4 },
      { "day": "금", "received": 42, "sent": 4 },
      { "day": "토", "received": 16, "sent": 1 },
      { "day": "일", "received": 10, "sent": 0 }
    ],
    "byCategory": [
      { "name": "뉴스레터/구독", "value": 96 },
      { "name": "공공/영업", "value": 88 },
      { "name": "내부 경영/공지", "value": 44 },
      { "name": "기타/개인", "value": 28 },
      { "name": "부동산/자산", "value": 22 }
    ],
    "topContacts": [
      { "name": "민정식 차장 (CD본부)", "email": "jsmin@tilon.com", "received": 26, "sent": 3 },
      { "name": "이춘성 (CD본부)", "email": "cslee@tilon.com", "received": 18, "sent": 2 },
      { "name": "장용혁 프로 (전략운영)", "email": "yh.jang@tilon.com", "received": 12, "sent": 4 },
      { "name": "최백준 (자산/부동산)", "email": "kjun@tilon.com", "received": 10, "sent": 3 },
      { "name": "Tilon Daily News (입찰·뉴스)", "email": "dshan@tilon.com", "received": 6, "sent": 0 }
    ],
    "insights": [
      "수신의 약 1/3이 뉴스레터·입찰 다이제스트(IT Daily, 사내 Tilon Daily News 등) — 자동 분류·요약으로 처리 부하 절감 여지.",
      "공공/영업 메일이 88건으로 업무성 수신의 최다 — 우정사업본부·행안부 N2SF·병원 PoC 문의가 집중.",
      "발신 22건 대비 수신 278건으로 위임·후속 처리 위주. 미응답 6건 중 마곡 매각·PoC 일정 관련 건은 우선 처리 권장.",
      "※ 수·발신 총량은 Outlook 실측값, 일자별·카테고리·응답시간은 표본 기반 추정입니다. Gmail 재인증 및 전체 스레드 분석 시 정밀화됩니다."
    ]
  },
  "work": {
    "meetingHours": 12.5,
    "focusHours": 8.0,
    "meetingCount": 8,
    "timeAllocation": [
      { "category": "대외 미팅/영업", "hours": 12.5 },
      { "category": "집중 업무(제안·자료)", "hours": 8.0 },
      { "category": "메일/커뮤니케이션", "hours": 6.0 },
      { "category": "내부 경영/공지", "hours": 4.0 }
    ],
    "highlights": [
      "마곡 사옥 Edge DC 컨버전 전제 매각 추진 — 세빌스와 CA 유효기간(1년) 협의, DC 컨버전 전제 매각 방향 확정 및 IM 프로세스 조율.",
      "우정사업본부 인터넷 PC 제안 준비 — KT 협업으로 외부실사질의서·제안자료 작성, 6/29 제출 개시.",
      "충남대병원 VDI PoC 요청 확보(ACK 협력) — VMware 700user 성능 이슈에 따른 대체 검증 기회.",
      "부산 전문대협의회 특강(대표 세션) 수행 및 전주기전대학 솔루션 도입 검토 착수.",
      "포스코·현대자동차 VDI 사업 현황 점검(포스코 Citrix 계약 종료 후 전환 검토).",
      "7/2 하반기 사업계획 발표 자료 준비 착수(표준 양식 확보)."
    ],
    "insights": [
      "대외 미팅·영업이 월·금에 집중되어 제안 마감(우정사업본부 7/3)과 겹침 — 후속 자료 작업 부하가 다음 주로 이월.",
      "공공(우정사업본부·행안부 N2SF)과 병원(충남대) 신규 기회가 동시 진행 — 엔지니어 PoC 리소스 조율이 병목 가능."
    ]
  },
  "market": {
    "competitors": [
      {
        "name": "VMware (Broadcom)",
        "summary": "충남대병원이 VMware 700user 운영 중 성능 이슈로 스토리지 방식 전환을 검토, 틸론 VDI PoC를 직접 요청. 성능 우위 입증 시 대체 기회.",
        "signals": ["충남대병원 성능 이슈로 PoC 요청", "\"VMware보다 성능이 좋다\"는 현장 인식", "HCI 스토리지 전환 검토"],
        "sentiment": "positive"
      },
      {
        "name": "Citrix",
        "summary": "포스코가 Citrix 1년 계약으로 VDI 운영 중이며 계약 종료 이후 계획을 검토. 종료 시점 확인 시 전환 제안 기회.",
        "signals": ["포스코 Citrix 1년 계약 운영", "계약 종료 후 대체 검토", "종료 시점 추가 확인 예정"],
        "sentiment": "neutral"
      }
    ],
    "trends": [
      "AI 국가 인프라 경쟁 본격화 — 정부 '3대 메가 프로젝트' 가동, 승부처가 LLM에서 데이터센터·전력·GPU 확보로 이동.",
      "공공 입찰에서 클라우드 네이티브 AI·대규모 GPU 실시간 모니터링 등 인프라형 과제 증가(KISTI 등).",
      "피지컬AI(Physical AI) R&D 확대 — NIPA '협업지능 피지컬AI 기반 SW플랫폼' 생태계 조성 사업 공고.",
      "공공 보안 정책 전환(N2SF 망분리 개선, CSAP)으로 VDI·제로트러스트 수요 지속.",
      "재택·원격 보안 수요로 고성능 VDI에 대한 공공기관 도입 확대(업계 보도)."
    ],
    "opportunities": [
      "충남대병원·데상트코리아 PoC를 VMware/글로벌 대비 '성능 우위' 레퍼런스로 전환.",
      "우정사업본부·행안부 N2SF 등 공공 VDI/DaaS 대형 입찰 파이프라인 확대.",
      "마곡 사옥의 Edge 데이터센터 컨버전으로 AI 인프라 트렌드에 자산 전략 정렬.",
      "NIPA 피지컬AI 등 정부 R&D 과제로 기술 로드맵·매출 다변화."
    ],
    "threats": [
      "VMware·Citrix 등 글로벌 대비 대규모 레퍼런스·생태계 격차.",
      "공공 사업의 CSAP·발표평가 등 일정 리스크(우정사업본부 7/2 CSAP, 7/8 발표).",
      "부동산 매각의 Edge DC 컨버전 실현 가능성(수전·인허가) 불확실성."
    ]
  },
  "goals": [
    {
      "title": "우정사업본부 인터넷 PC 제안 제출·발표 완주",
      "rationale": "KT 협업 제안 건, 제출·CSAP·발표평가가 다음 주 연속 배치되어 실행 밀도 최고.",
      "metric": "7/3 10:00 제안 제출 완료, 7/2 CSAP 서류 마감 준수, 7/8 발표평가 리허설 1회 완료",
      "priority": "high",
      "category": "공공영업"
    },
    {
      "title": "마곡 사옥 Edge DC 컨버전 매각 프로세스 진전",
      "rationale": "세빌스 CA 협의 단계 — DC 컨버전 전제 매각의 확실성 확보가 관건.",
      "metric": "CA 최종 서명 완료 및 IM 배포, 수전·컨버전 가능성 검토 미팅 1건 확정",
      "priority": "high",
      "category": "자산전략"
    },
    {
      "title": "하반기 사업계획 발표 자료 확정",
      "rationale": "7/2 전사 발표 — CD본부 하반기 전략·목표를 표준 양식으로 정렬.",
      "metric": "7/1까지 발표 자료 v1 완성 및 리허설, 핵심 KPI(공공·병원·자산) 명시",
      "priority": "high",
      "category": "전략"
    },
    {
      "title": "VDI PoC 성능 우위 레퍼런스화",
      "rationale": "충남대병원(ACK)·데상트 PoC가 VMware 대체 근거 확보의 핵심.",
      "metric": "7/8 데상트 PoC 방문 및 충남대병원 PoC 설치 일정 확정, 성능 비교 지표 정의",
      "priority": "medium",
      "category": "영업"
    },
    {
      "title": "포스코 Citrix 대체 제안 기반 마련",
      "rationale": "Citrix 계약 종료 후 전환 검토 — 조기 접점이 수주 확률을 좌우.",
      "metric": "포스코 Citrix 계약 종료 시점 확인 및 자사 VDI 개선요청 대응안 1건 도출",
      "priority": "medium",
      "category": "영업"
    }
  ]
}
